{
  "request_id": "req-demo-read-01",
  "timestamp": "2026-05-27T12:00:00Z",
  "subject": {
    "type": "agent",
    "agent_id": "agent://finance/invoice-reconciler",
    "agent_version": "1.2.0"
  },
  "action": {
    "name": "erp.invoice.read",
    "risk": "low"
  },
  "resource": {
    "type": "erp.invoice",
    "id": "INV-2026-0042"
  },
  "tool": {
    "name": "query_invoices",
    "protocol": "mcp"
  }
}
